url,nombre,precio,descripcion,unidad,precio_unidad
https://www.plazavea.com.pe/arroz-extra-costeno-bolsa-5kg/p,Arroz Extra COSTEÑO Bolsa 5Kg,26.9,¡Compra Online Arroz Extra COSTEÑO Bolsa 5Kg desde donde estés en plazaVea.com.pe!,5 kg,5.38/kg
https://www.plazavea.com.pe/arroz-extra-vallenorte-bolsa-5kg/p,Arroz Extra Añejo VALLENORTE Gran Reserva Bolsa 5Kg,26.49,¡Compra Online Arroz Extra Añejo VALLENORTE Gran Reserva Bolsa 5Kg desde donde estés en plazaVea.com.pe!,5 kg,5.30/kg
https://www.plazavea.com.pe/arroz-extra-paisana-bolsa-5kg/p,Arroz Extra PAISANA Bolsa 5Kg,4.99,¡Compra Online Arroz Extra PAISANA Bolsa 5Kg desde donde estés en plazaVea.com.pe!,5 kg,1.00/kg
https://www.plazavea.com.pe/arroz-extra-bell-s-bolsa-5kg/p,Arroz Extra BELL'S Bolsa 5Kg,21.0,¡Compra Online Arroz Extra BELL S Bolsa 5Kg desde donde estés en plazaVea.com.pe!,5 kg,4.20/kg
https://www.plazavea.com.pe/arroz-extra-faraon-bolsa-5kg/p,Arroz Extra Añejo FARAON Naranja Bolsa 5kg,4.99,¡Compra Online Arroz Extra FARAON Bolsa 5kg desde donde estés en plazaVea.com.pe!,5 kg,1.00/kg
https://www.plazavea.com.pe/piernas-y-muslos-aderezadas-redondos-oriental-bolsa-780g/p,Piernas y Muslos Aderezo Oriental REDONDOS Bolsa 780g,16.5,¡Compra online Piernas y Muslos Aderezo Oriental REDONDOS Bolsa 780g desde donde estés en plazaVea.com.pe!,780 g,0.02/g
https://www.plazavea.com.pe/filete-de-pechuga-importado-sadia-empaque-1kg/p,Filete de Pechuga Importado SADIA Bolsa 1Kg,4.99,¡Compra online Filete de Pechuga Importado SADIA Bolsa 1Kg desde donde estés en plazaVea.com.pe!,1 kg,4.99/kg
https://www.plazavea.com.pe/muslitos-de-pollo-copacol-bolsa-800g/p,,,"Compra en plazaVea Online y encuentra los mejores precios en Supermercado, Electro, Colchones y más. ¡Ingresa aquí!",,
https://www.plazavea.com.pe/pollo-entero-sin-menudencia-congelado-perdix-1300g/p,Pollo Entero sin Menudencia Congelado PERDIX 1300g,4.99,¡Compra online Pollo Entero sin Menudencia Congelado PERDIX 1300g desde donde estés en plazaVea.com.pe!,1300 g,0.00/g
https://www.plazavea.com.pe/pollo-entero-artisan-libre-de-antibioticos-x-kg/p,Pollo Entero ARTISAN Libre de Antibióticos x kg,4.99,¡Compra online Pollo Entero ARTISAN Libre de Antibióticos x kg desde donde estés en plazaVea.com.pe!,,
https://www.plazavea.com.pe/cafe-instantaneo-nescafe-fina-seleccion-frasco-200g/p,Café Instantáneo NESCAFÉ Fina Selección Frasco 200g,4.99,¡Compra Online Café Instantáneo NESCAFÉ Fina Selección Frasco 200g desde donde estés en plazaVea.com.pe!,200 g,0.02/g
https://www.plazavea.com.pe/cafe-liofilizado-juan-valdez-regular-frasco-190g/p,Café Liofilizado JUAN VALDEZ Regular Frasco 190g,4.99,¡Compra Online Café Liofilizado JUAN VALDEZ Regular Frasco 190g desde donde estés en plazaVea.com.pe!,190 g,0.03/g
https://www.plazavea.com.pe/cafe-instantaneo-altomayo-gourmet-frasco-170g/p,Café Instantáneo ALTOMAYO Gourmet Frasco 170g,32.5,¡Compra Online Café Instantáneo ALTOMAYO Gourmet Frasco 170g desde donde estés en plazaVea.com.pe!,170 g,0.19/g
https://www.plazavea.com.pe/cafe-tostado-y-molido-cafetal-selecto-bolsa-900g/p,Café Tostado y Molido CAFETAL Selecto Bolsa 900g,4.99,¡Compra Online Café Tostado y Molido CAFETAL Selecto Bolsa 900g desde donde estés en plazaVea.com.pe!,900 g,0.01/g
https://www.plazavea.com.pe/cafe-instantaneo-bells-granulado-frasco-200g/p,Café Instantáneo BELL'S Granulado Frasco 200g,4.99,¡Compra Online Café Instantáneo BELL S Granulado Frasco 200g desde donde estés en plazaVea.com.pe!,200 g,0.02/g
https://www.plazavea.com.pe/aceite-vegetal-premium-primor-botella-900ml/p,Aceite Vegetal Premium PRIMOR Botella 900ml,11.0,¡Compra Online Aceite Vegetal Premium PRIMOR Botella 900mldesde donde estés en plazaVea.com.pe!,900 ml,0.01/ml
https://www.plazavea.com.pe/aceite-de-oliva-y-girasol-carbonell-botella-1l/p,Aceite de Girasol y Oliva CARBONELL Botella 1L,4.99,¡Compra online Aceite de Girasol y Oliva CARBONELL Botella 1L desde donde estés en plazaVea.com.pe!,1 l,4.99/l
https://www.plazavea.com.pe/aceite-vegetal-cocinero-botella-900ml/p,Aceite Vegetal COCINERO Botella 900ml,4.99,¡Compra Online Aceite Vegetal COCINERO Botella 900ml desde donde estés en plazaVea.com.pe!,900 ml,0.01/ml
https://www.plazavea.com.pe/aceite-vegetal-bells-botella-900ml/p,Aceite Vegetal BELL'S Botella 900ml,6.1,¡Compra Online Aceite Vegetal BELL S Botella 900ml desde donde estés en plazaVea.com.pe!,900 ml,0.01/ml
https://www.plazavea.com.pe/aceite-de-oliva-el-olivar-extra-virgen-botella-200ml/p,Aceite de Oliva EL OLIVAR Extra Virgen Botella 200ml,4.99,¡Compra Online Aceite de Oliva EL OLIVAR Extra Virgen Botella 200ml desde donde estés en plazaVea.com.pe!,200 ml,0.02/ml
https://www.plazavea.com.pe/leche-uht-sin-lactosa-gloria-zero-caja-1l/p,Leche UHT sin Lactosa GLORIA Zero Caja 1L,4.99,¡Compra online Leche UHT sin Lactosa GLORIA Zero Caja 1L desde donde estés en plazaVea.com.pe!,1 l,4.99/l
https://www.plazavea.com.pe/leche-fresca-laive-entera-bolsa-900ml/p,Leche UHT LAIVE Entera Bolsa 900ml,4.99,¡Compra Online Leche Fresca LAIVE Entera Bolsa 900ml desde donde estés en plazaVea.com.pe!,900 ml,0.01/ml
https://www.plazavea.com.pe/leche-uht-vigor-bolsa-800ml/p,Leche UHT VIGOR Bolsa 800ml,4.99,¡Compra Online Leche UHT VIGOR Bolsa 800ml desde donde estés en plazaVea.com.pe!,800 ml,0.01/ml
https://www.plazavea.com.pe/leche-descremada-gloria-slim-uht-triple-zero-caja-1l/p,Leche Descremada GLORIA Slim UHT Triple Zero Caja 1L,4.99,¡Compra online Leche Descremada GLORIA Slim UHT Triple Zero Caja 1L desde donde estés en plazaVea.com.pe!,1 l,4.99/l
https://www.plazavea.com.pe/leche-entera-bells-caja-1l/p,Leche Entera BELL'S Caja 1L,4.99,¡Compra online Leche Entera BELL S Caja 1L desde donde estés en plazaVea.com.pe!,1 l,4.99/l
https://www.plazavea.com.pe/huevos-pardos-bells-bandeja-30un/p,Huevos Pardos BELL'S Bandeja 30un,20.9,¡Compra Online Huevos Pardos BELL S Bandeja 30un desde donde estés en plazaVea.com.pe!,,
https://www.plazavea.com.pe/huevos-pardos-la-calera-paquete-30un/p,Huevos Pardos LA CALERA Paquete 30un,4.99,¡Compra Online Huevos Pardos LA CALERA Paquete 30un desde donde estés en plazaVea.com.pe!,,
https://www.plazavea.com.pe/huevos-pardos-artisan-bandeja-15un/p,Huevos Pardos ARTISAN Bandeja 15un,4.99,¡Compra online Huevos Pardos ARTISAN Bandeja 15un desde donde estés en plazaVea.com.pe!,,
https://www.plazavea.com.pe/huevos-pardos-gallinas-libres-bandeja-12un/p,Huevos Pardos GALLINAS LIBRES Bandeja 12un,4.99,¡Compra Online Huevos Pardos GALLINAS LIBRES Bandeja 12un desde donde estés en plazaVea.com.pe!,,
https://www.plazavea.com.pe/azucar-rubia-dulfina-bolsa-5-kg/p,Azúcar Rubia DULFINA Bolsa 5Kg,21.9,¡Compra Online Azúcar Rubia DULFINA Bolsa 5Kg desde donde estés en plazaVea.com.pe!,5 kg,4.38/kg
https://www.plazavea.com.pe/azucar-rubia-cartavio-bolsa-5kg/p,Azúcar Rubia CARTAVIO Bolsa 5Kg,22.5,¡Compra Online Azúcar Rubia CARTAVIO Bolsa 5Kg desde donde estés en plazaVea.com.pe!,5 kg,4.50/kg
https://www.plazavea.com.pe/azucar-rubia-bells-bolsa-1kg/p,Azúcar Rubia BELL'S Bolsa 1Kg,4.99,¡Compra Online Azúcar Rubia BELL S Bolsa 1Kg desde donde estés en plazaVea.com.pe!,1 kg,4.99/kg
https://www.plazavea.com.pe/azucar-rubia-costeno-bolsa-1kg/p,,,"Compra en plazaVea Online y encuentra los mejores precios en Supermercado, Electro, Colchones y más. ¡Ingresa aquí!",,
https://www.plazavea.com.pe/azucar-rubia-casa-grande-bolsa-5kg/p,Azúcar Rubia CASA GRANDE Bolsa 5Kg,4.99,¡Compra Online Azúcar Rubia CASA GRANDE Bolsa 5Kg desde donde estés en plazaVea.com.pe!,5 kg,1.00/kg
https://www.plazavea.com.pe/pan-de-molde-blanco-xl-bimbo-extra-grande-bolsa-770g/p,Pan de Molde Blanco XL BIMBO Extra Grande Bolsa 770g,12.5,¡Compra online Pan de Molde Blanco XL BIMBO Extra Grande Bolsa 770g desde donde estés en plazaVea.com.pe!,770 g,0.02/g
https://www.plazavea.com.pe/pan-de-molde-blanco-bells-mediano-bolsa-500g/p,Pan de Molde Blanco BELL'S Mediano Bolsa 500g,4.99,¡Compra Online Pan de Molde Blanco BELL S Mediano Bolsa 500g desde donde estés en plazaVea.com.pe!,500 g,0.01/g
https://www.plazavea.com.pe/pan-de-molde-union-multisemillas-y-avena-bolsa-540g/p,Pan de Molde UNIÓN Multisemillas y Avena Bolsa 540g,4.99,¡Compra Online Pan de Molde UNIÓN Multisemillas y Avena Bolsa 540g desde donde estés en plazaVea.com.pe!,540 g,0.01/g
https://www.plazavea.com.pe/pan-de-molde-blanco-don-mamino-sin-corteza-bolsa-560g/p,Pan de Molde Blanco DON MAMINO sin Corteza Bolsa 560g,4.99,¡Compra Online Pan de Molde Blanco DON MAMINO sin Corteza Bolsa 560g desde donde estés en plazaVea.com.pe!,560 g,0.01/g
https://www.plazavea.com.pe/pan-de-molde-integral-bimbo-vital-multicereal-bolsa-600g/p,Pan de Molde Integral BIMBO Vital Multicereal Bolsa 600g,4.99,¡Compra Online Pan de Molde Integral BIMBO Vital Multicereal Bolsa 600g desde donde estés en plazaVea.com.pe!,600 g,0.01/g
https://www.plazavea.com.pe/spaghetti-don-vittorio-paquete-950g/p,Spaghetti DON VITTORIO Paquete 950g,7.0,¡Compra Online Spaghetti DON VITTORIO Paquete 950gdesde donde estés en plazaVea.com.pe!,950 g,0.01/g
https://www.plazavea.com.pe/fideo-cabello-de-angel-lavaggi-bolsa-250g/p,Fideo Cabello de Ángel LAVAGGI Bolsa 250g,4.99,¡Compra Online Fideo Cabello de Ángel LAVAGGI Bolsa 250g desde donde estés en plazaVea.com.pe!,250 g,0.02/g
https://www.plazavea.com.pe/fideos-spaguetti-bells-bolsa-900g/p,Fideos Spaghetti BELL'S Bolsa 900g,4.99,¡Compra online Fideos Spaghetti BELL S Bolsa 900g desde donde estés en plazaVea.com.pe!,900 g,0.01/g
https://www.plazavea.com.pe/fideos-spaghetti-barilla-caja-500g/p,Fideos Spaghetti #5 BARILLA Caja 500g,4.99,¡Compra Online Fideos Spaghetti #5 BARILLA Caja 500g desde donde estés en plazaVea.com.pe!,500 g,0.01/g
https://www.plazavea.com.pe/pasta-tornillo-molitalia-bolsa-500g/p,Esta página no funciona,,,,
https://www.plazavea.com.pe/filete-de-atun-en-aceite-vegetal-florida-lata-140g/p,Filete de Atún en Aceite Vegetal FLORIDA Lata 140g,4.99,¡Compra Online Filete de Atún en Aceite Vegetal FLORIDA Lata 140g desde donde estés en plazaVea.com.pe!,140 g,0.04/g
https://www.plazavea.com.pe/filete-de-atun-campomar-en-aceite-lata-150g/p,Filete de Atún CAMPOMAR en Aceite Vegetal Lata 150g,4.99,¡Compra Online Filete de Atún CAMPOMAR en Aceite Vegetal Lata 150g desde donde estés en plazaVea.com.pe!,150 g,0.03/g
https://www.plazavea.com.pe/trozos-de-atun-bells-en-aceite-lata-150gr/p,Trozos de Atún BELL'S en Aceite Lata 150gr,4.4,¡Compra online Trozos de Atún BELL S en Aceite Lata 150gr desde donde estés en plazaVea.com.pe!,150 g,0.03/g
https://www.plazavea.com.pe/filete-de-atun-en-agua-y-sal-gloria-lata-140g/p,Filete de Atún en Agua y Sal GLORIA Lata 140g,4.99,¡Compra Online Filete de Atún en Agua y Sal GLORIA Lata 140g desde donde estés en plazaVea.com.pe!,140 g,0.04/g
https://www.plazavea.com.pe/trozos-de-atun-primor-en-aceite-vegetal-lata-140g/p,Trozos de Atún PRIMOR en Aceite Vegetal Lata 140g,6.5,¡Compra Online Trozos de Atún PRIMOR en Aceite Vegetal Lata 140g desde donde estés en plazaVea.com.pe!,140 g,0.05/g
